,0
57,"['Trump Blocks Green Cards During Coronavirus', 'Trump’s Latest Attempt To Limit Immigration Isn’t Really About The Coronavirus', 'Trump could reboot his reelection bid on immigration. Don’t bet against him.', 'Immigrants are not the problem but part of the coronavirus solution', 'Dale Wilcox: Trump\'s coronavirus immigration halt is legal and necessary']['WASHINGTON — President Trump said on Tuesday that he would order a temporary halt in issuing green cards to prevent people from immigrating to the ...', 'Not many public health experts have been calling for new limits on immigration as a major part of the U.S. strategy to fight the spread of the coronavirus. In f…', 'His proposed executive order is a chance to reframe the immigration issue.', 'While Trump\'s suspension of immigration seeks to shift blame for his poor leadership, we need immigrants to help in the fight against COVID-19.', 'Get all the latest news on coronavirus and more delivered daily to your inbox. Sign up here. Critics of President Trump have made endless arguments that he ...']"
58,"['Virgin Australia enters voluntary administration. Richard Branson says it\'s \'not the end\'', 'Delta Won’t Invest More Money Into Virgin Atlantic', 'So much for entitled millennials – it’s billionaires such as Richard Branson who are begging for loans', 'Richard Branson Doesn\'t Have a Drop to Drink']['Hong Kong (CNN Business) Virgin Australia has collapsed into administration, one day after billionaire founder Richard Branson made a last-ditch appeal for ...', 'Ed Bastian, the Chief Executive Officer of Delta Air Lines, has today announced that his carrier would not be offering any kind of support to alleviate the financial ...', 'Young people are often lambasted for failing to take financial responsibility, so why should Virgin be saved by taxpayers, asks Arwa Mahdawi.', 'Despite a $5.9 billion net worth, Richard Branson is strapped for cash. His Virgin Galactic business might be better collateral than his private island.']"
59,"['Air Canada suspends all US flights, likely for first time in nearly 80 years', 'Air Canada To Suspend All Transborder Service', 'Air Canada Suspends All Flights To The US', 'Air Canada is suspending all flights to the US next week due to coronavirus border restrictions']['Air Canada will suspend all flights south of the border following the Canadian and U.S. governments\' decision to extend their border closure for another month to ...', 'After cutting its overseas flights and sharply limiting *service* within North America over the past month, Air Canada announced today that it will be halting all ...', 'Today, Air Canada announced that it would entirely suspend scheduled transborder flights after April 26. This move comes following the extension of the travel ...', 'Air Canada is suspending all flights between the US and Canada beginning April 27, the airline said Tuesday. *Service* is set to resume May 22, pending ...']"
60,"['Denmark and Poland are refusing to bail out companies registered in offshore tax havens - Business Insider', 'Denmark Will Not Give Aid To Companies Registered in Tax Havens', 'Denmark bans tax haven companies from accessing coronavirus bailout money – will other countries follow?', 'Coronavirus in Scotland: Sturgeon questions bailouts for tax haven firms', 'Denmark says companies registered in tax havens won\'t get coronavirus bailout']['Governments around the world are offering financial assistance to struggling firms in the wake of the coronavirus crisis.', 'The Danish government announced on Saturday that none of its US$58 billion in coronavirus aid would be issued to companies that register in tax havens, pay ...', 'Denmark has told companies that they will not be eligible for bailout funds to help them through the coronavirus pandemic if they are registered in tax havens, ...', 'NICOLA Sturgeon has backed the denial of coronavirus aid to firms registered in tax havens.', 'Companies which pay out dividends to shareholders, buy back own shares or are registered in tax havens won\'t be eligible for any of the country\'s aid programs.']"
61,"['Coronavirus Death Toll Soars in Turkey; W.H.O. Warns of Vaccine Roadblock', 'Anti-Lockdown Brazilian President Coughs Throughout Speech During Protest', 'Bolsonaro seeks to end Brazil’s social distancing', 'Brazilian President Jair Bolsonaro coughs on anti-lockdown protesters']['An early success story, Singapore is having a surge in cases. The director of a Chinese lab rejected suggestions that the virus originated there.', 'Four days after firing his health minister amid the coronavirus pandemic, Brazilian President Jair Bolsonaro has said he wants social isolation policies News ...', 'Many of the country\'s states, however, have vowed to maintain lockdown measures.', 'Four days after firing his health minister amid the coronavirus pandemic, Brazilian President Jair Bolsonaro has said he wants social isolation policies to end ...']"
62,"['Coronavirus travel upside: More airlines banish the dreaded middle seat', 'Coronavirus travel upside: More airlines around the world banish the dreaded middle seat']['More airlines are temporarily banishing one of the most dreaded aspects of modern air travel: being assigned a middle seat. To further the goal of social ...', 'More airlines are temporarily banishing one of the most dreaded aspects of modern air travel: being assigned a middle seat. To further the goal of social ...']"
63,"['Three months in: A timeline of how COVID-19 has unfolded in the US', 'Why Trump Deserves More Blame for the U.S. Coronavirus Crisis Than the WHO or China', 'Scientists Haven’t Found Proof The Coronavirus Escaped From A Lab In Wuhan. Trump Supporters Are Spreading The Rumor Anyway.', 'WHO says coronavirus came from an animal and was not made in a lab']['Here\'s a look back on how the coronavirus outbreak began, and how it has unfolded in the U.S. so far.', 'Jeremy Konyndyk, the Obama administration official who has become one of the foremost critics of Trump\'s coronavirus response, explains why trying to ...', 'There\'s much about the origins of the COVID-19 outbreak that scientists are still trying to discover. But animosity between the United States and China — and a ...', 'The available evidence indicates coronavirus originated in animals in China late last year and was not manipulated or produced in a laboratory as has been ...']"
64,"['How Coronavirus Spread In One Restaurant Shows Why Air Travel Is Safer Than You Think', 'Coronavirus may have spread via air conditioning in Chinese restaurant, researchers warn', 'Air Conditioning May Spread Coronavirus — 9 People Were Infected at a Restaurant', 'Picture: How restaurant AC gave 9 people COVID-19 in Guangzhou, China - Business Insider', 'Why is this Chinese junk deemed credible?']['In a time of standing six feet apart and avoiding confined spaces, there are naturally concerns about the health safety of air travel where passengers are ...', 'A newly published research letter suggests that three healthy families in China may have contracted the SARS-CoV-2 virus after it traveled via air conditioning at ...', 'When restaurants are able to reopen, they may need to do more than just move their tables further apart. A new study found that nine people were infected with ...', 'According to a scientific paper, restaurant AC boosted the distance that virus particles could travel form an infected diner to other people.', 'Industry experts have questioned the reliability of a Chinese report that claims air conditioning was responsible for spreading the coronavirus at a restaurant in ...']"
65,"['Airline passengers undergo COVID-19 blood tests before boarding', 'Emirates Flights To Remain Grounded Until Q3', 'Emirates To Ban Most Cabin Baggage To Curb Coronavirus Spread', 'Dubai Airports planning for phased travel re-start after Covid-19 restrictions lift', 'When Dubai is Back in Business the World can Take to the Air']['Perhaps a sign of what the future holds for air travelers, Dubai-based airline Emirates has begun carrying out COVID-19 blood tests on passengers at the airport ...', 'Emirates will not resume normal flights until July at the earliest, according to its updated schedule.', 'UAE flag-carrier Emirates announced Tuesday that it is stepping up precautionary measures to stop further spread of COVID-19. As a result, the airline is now ...', 'Airport operator provides relief measures for aviation partners affected by travel shutdown.', 'Dubai\'s economic future is dependent on airline traffic.']"
66,"['Virus lockdowns have led to cleaner air, but will it last? ""It doesn\'t have to be shelter at home or clean air""']['Los Angeles has some of the cleanest air in the world with lockdowns in place.']"
67,"['Jellyfish spotted in Venice canals during coronavirus lockdown', 'Jellyfish Spotted Gliding Through The Now Crystal Clear Venice Canals | KFI', 'Video shows jellyfish gliding through clear Venice canal - Insider']['As Italians isolate amid the coronavirus pandemic, jellyfish were spotted gliding about Venice\'s newly-clear canals on Easter in a viral video.', 'While Italy has been on lockdown the past six weeks, the canals of Venice have been empty. Without any tourists exploring the city, boat traffic has reduced, and ...', 'The incredible flora and fauna of the Venetian canals have been caught on video as the lack of boats on the waterways leaves the water to clear and natural life ...']"
68,"['How Coronavirus Infected Some, but Not All, in a Restaurant', 'Coronavirus China: Restaurant air con spread illness to nine', 'Coronavirus pandemic | How COVID-19 spread through an AC duct at a Chinese restaurant', 'From 1 to 9: How AC air spread coronavirus to 3 families at a restaurant in China']['In January, at a restaurant in Guangzhou, China, one diner infected with the novel coronavirus but not yet feeling sick appeared to have spread the disease to ...', 'Researchers have investigated an incident at an eatery in Guangzhou, China, where an asymptomatic customer later fell ill, along with others who were sat on ...', 'Although the other diners who got infected never interacted with the family of the carrier, they contracted the disease when the virus travelled through the air ...', 'A family that arrived in China\'s Guangzhou from Wuhan spread the virus to two other families while dining at a restaurant. The virus transmission happened ...']"
69,"['Netflix says these three effects of the coronavirus crisis are impacting its business', 'Netflix adds 15 million subscribers, but warns about tough road ahead', 'Why Netflix Shares Are Down Despite Blowing Away Subscriber Estimates', 'Netflix gets twice as many subscribers in Q1 than expected, but a decline may be looming ahead']['Netflix has seen its stock outperform in the past quarter, as the Covid-19 crisis keeps people home and in need of entertainment.', 'Netflix is one of the rare companies benefiting from the global pandemic, which has kept billions of people at home with nothing to do but stream. But the ...', 'Netflix delivered a home run on new subscribers last quarter. And yet the response from investors on Wednesday appeared to be a collective: ""Meh."".', 'A letter sent to shareholders reveals that not all is going well for the streaming *service*.']"
